{
  "fixed_test_run_id": "fullchain_price_volume_multisignal_core_20260419_1008",
  "run_id": "fullchain_price_volume_multisignal_core_20260419_1008",
  "attempt_id": "attempt_20260419_100950",
  "generated_at": "2026-04-19T10:15:07.352497+08:00",
  "candidate_scheme_id": "price_volume_multisignal_v13_core",
  "research_round_id": "rr_price_volume_multisignal_family_20260419",
  "low_liquidity_holding_count": 588,
  "low_liquidity_weight_total": 2.672727272727266,
  "low_liquidity_weight_share": 0.009513639452478928,
  "low_liquidity_contribution_total": -0.023219876407640293,
  "low_liquidity_contribution_share_of_strategy": 0.02740091239613389,
  "low_liquidity_alpha_contribution_share": 0.03837218091414364,
  "flag_high_low_liquidity_exposure": false
}
