{
  "fixed_test_run_id": "confirmatory_fixed_test_vsumd60_seed_linear_rank_decay_trainval_20260429",
  "run_id": "confirmatory_vsumd60_seed_linear_rank_decay_trainval_20260429",
  "attempt_id": "attempt_20260429_173136",
  "generated_at": "2026-04-29T17:34:26.771993+08:00",
  "candidate_scheme_id": "confirmatory_alpha158_vsumd60_seed_linear_rank_decay_v1",
  "research_round_id": "rr_confirmatory_alpha158_vsumd60_family_seed_head_extraction_20260429",
  "low_liquidity_holding_count": 7140,
  "low_liquidity_weight_total": 32.16017316017306,
  "low_liquidity_weight_share": 0.12934891997395465,
  "low_liquidity_contribution_total": 0.02739787678549888,
  "low_liquidity_contribution_share_of_strategy": 0.02385137369942544,
  "low_liquidity_alpha_contribution_share": 0.013780392782208328,
  "flag_high_low_liquidity_exposure": false
}
