{
  "fixed_test_run_id": "fullchain_baseline_broadened_head_extraction_20260418_2315",
  "run_id": "fullchain_baseline_broadened_head_extraction_20260418_2315",
  "attempt_id": "attempt_20260418_232405",
  "generated_at": "2026-04-18T23:29:37.502346+08:00",
  "candidate_scheme_id": "baseline_momentum_v10_broadened_head_extraction",
  "research_round_id": "rr_baseline_broadened_head_extraction_20260418",
  "low_liquidity_holding_count": 1265,
  "low_liquidity_weight_total": 5.705454545454543,
  "low_liquidity_weight_share": 0.018468220594597382,
  "low_liquidity_contribution_total": -0.04137846445231089,
  "low_liquidity_contribution_share_of_strategy": -0.14030456427279914,
  "low_liquidity_alpha_contribution_share": -0.21052369108344718,
  "flag_high_low_liquidity_exposure": false
}
