{
  "fixed_test_run_id": "ft_minimal_fullchain_20260417",
  "run_id": "fullchain_reviewfix_20260417_160610",
  "attempt_id": "attempt_fullchain_reviewfix_20260417_160610",
  "generated_at": "2026-04-17T21:02:14.612957+08:00",
  "candidate_scheme_id": "baseline_reversal_momentum_lowvol_liquidity_v1",
  "research_round_id": "rr_baseline_scaffold_20260417",
  "low_liquidity_holding_count": 58818,
  "low_liquidity_weight_total": 189.73548387098035,
  "low_liquidity_weight_share": 0.9999829986908992,
  "low_liquidity_contribution_total": -0.7300600293283025,
  "low_liquidity_contribution_share_of_strategy": 0.999168372985546,
  "low_liquidity_alpha_contribution_share": 1.3684531163107034,
  "flag_high_low_liquidity_exposure": true
}
